{
  "schema_version": "prompt-outcome-receipt/v1",
  "receipt_id": "field/20260916/p142-drive-organizer",
  "related_receipt_ids": [
    "field/20260916/p123-gemini-drive-title"
  ],
  "invocation": {
    "invocation_id": "field/20260916/p142-drive-organizer",
    "prompt_id": "P142",
    "prompt_revision": "93a8886d77e043023eeecca05f5e2e8e13b89f06",
    "surface_id": "chatgpt-google-drive",
    "mission_id": "field-proof/p142-drive-organizer",
    "target_runtime": "google-drive",
    "repository": "EndeavorEverlasting/web-excel-repair-triage"
  },
  "observer": {
    "observer_id": "agent/chatgpt",
    "kind": "agent",
    "surface_id": "google-drive-connector"
  },
  "observation": {
    "type": "provider",
    "summary": "Synthetic Drive organization preserved file identity, URLs, and ownership/sharing metadata while changing only parent folders, followed by folder and metadata readback.",
    "expected_state": "Identity, links, and permissions stay stable while organization changes only parent placement.",
    "observed_state": "Same file IDs and URLs; unchanged ownership/sharing metadata; expected child-folder membership after move.",
    "claimed_state": "OBSERVED",
    "signal_ids": []
  },
  "result": "SUCCESS",
  "classification": {
    "primary": null,
    "secondary": [],
    "confidence": "HIGH",
    "attribution": "PROVEN",
    "actionability": "INFORMATION_ONLY",
    "rationale": "Bounded provider readback proved the declared synthetic P142 organization invariants without touching the user's production corpus."
  },
  "evidence": [
    {
      "kind": "provider",
      "ref": "github:pr/516#issuecomment-5707631503",
      "supports": "Durable field-proof summary records identity, link, permission, parent, readback, and cleanup observations."
    },
    {
      "kind": "repository",
      "ref": "github:commit/93a8886d77e043023eeecca05f5e2e8e13b89f06",
      "supports": "Merged P142/P123/P111 implementation floor exercised by the synthetic Drive probe."
    }
  ],
  "state_transition": {
    "from": "INTEGRATED",
    "to": "OBSERVED"
  },
  "occurred_at": "2026-09-17T01:55:36Z",
  "retrospective": false
}
